[
  {
    "key": "additional_endpoints",
    "feature_state": "PARITY",
    "action": "NONE",
    "description": "Dual-ship to extra endpoints",
    "reason": "Confirmed implemented in both ADP and core agent.",
    "issue": null,
    "adp_key": null
  },
  {
    "key": "agent_ipc_endpoint",
    "feature_state": "ADP_ONLY",
    "action": "INVESTIGATE",
    "description": "Remote agent IPC URI",
    "reason": "ADP uses a combined URI key; core agent uses agent_ipc.host+port. Investigation open to migrate to the standard agent_ipc.* namespace.",
    "issue": "#1368",
    "adp_key": null
  },
  {
    "key": "aggregate_context_limit",
    "feature_state": "PARITY",
    "action": "NONE",
    "description": "Max contexts per agg window",
    "reason": "Filed to raise the default; it is now CLOSED, meaning the fix is done. Feature is in parity.",
    "issue": "#1330",
    "adp_key": null
  },
  {
    "key": "aggregate_flush_interval",
    "feature_state": "ADP_ONLY",
    "action": "NONE",
    "description": "Aggregator flush period",
    "reason": "Hard-coded in core agent; configurable in ADP for flexibility.",
    "issue": null,
    "adp_key": null
  },
  {
    "key": "aggregate_flush_open_windows",
    "feature_state": "ADP_ONLY",
    "action": "NONE",
    "description": "Flush open windows on stop",
    "reason": "ADP's own key for dogstatsd_flush_incomplete_buckets. Hard-coded in core agent.",
    "issue": null,
    "adp_key": null
  },
  {
    "key": "aggregate_passthrough_idle_flush_timeout",
    "feature_state": "ADP_ONLY",
    "action": "NONE",
    "description": "Passthrough buffer flush delay",
    "reason": "ADP-only tuning knob for passthrough pipeline. No core agent equivalent.",
    "issue": null,
    "adp_key": null
  },
  {
    "key": "aggregate_window_duration_seconds",
    "feature_state": "ADP_ONLY",
    "action": "NONE",
    "description": "Aggregation window size",
    "reason": "Hard-coded in core agent; configurable in ADP.",
    "issue": null,
    "adp_key": null
  },
  {
    "key": "aggregator_buffer_size",
    "feature_state": "MISSING",
    "action": "INVESTIGATE",
    "description": "Channel buffer depth for aggregator queues",
    "reason": "Saluki topology uses fixed interconnect sizes and construction-time wiring; no per-component config knobs.",
    "issue": "#1681",
    "adp_key": null
  },
  {
    "key": "aggregator_flush_metrics_and_serialize_in_parallel_buffer_size",
    "feature_state": "MISSING",
    "action": "INVESTIGATE",
    "description": "Parallel flush: series/sketch buffer size",
    "reason": "Saluki topology uses fixed interconnect sizes; no per-component config knobs.",
    "issue": "#1681",
    "adp_key": null
  },
  {
    "key": "aggregator_flush_metrics_and_serialize_in_parallel_chan_size",
    "feature_state": "MISSING",
    "action": "INVESTIGATE",
    "description": "Parallel flush: channel size for series/sketches",
    "reason": "Saluki topology uses fixed interconnect sizes; no per-component config knobs.",
    "issue": "#1681",
    "adp_key": null
  },
  {
    "key": "aggregator_stop_timeout",
    "feature_state": "MISSING",
    "action": "INVESTIGATE",
    "description": "Timeout (seconds) for aggregator flush on stop",
    "reason": "Saluki topology uses fixed interconnect sizes and construction-time wiring; no per-component config knobs.",
    "issue": "#1681",
    "adp_key": null
  },
  {
    "key": "aggregator_tag_filter_cache_capacity",
    "feature_state": "MISSING",
    "action": "INVESTIGATE",
    "description": "Ring buffer size for tag-filter dedup cache",
    "reason": "Controls aggregator tag filter cache used by DogStatsD",
    "issue": "#1667",
    "adp_key": null
  },
  {
    "key": "aggregator_use_tags_store",
    "feature_state": "MISSING",
    "action": "INVESTIGATE",
    "description": "Enable shared tag deduplication store",
    "reason": "Core agent concept with no ADP analog.",
    "issue": "#1681",
    "adp_key": null
  },
  {
    "key": "allow_arbitrary_tags",
    "feature_state": "PARITY",
    "action": "NONE",
    "description": "Relax backend tag validation via HTTP header",
    "reason": "Implemented in ADP. When set, the Datadog forwarder adds `Allow-Arbitrary-Tag-Value: true` to outbound intake requests. Behavior matches the core agent.",
    "issue": null,
    "adp_key": null
  },
  {
    "key": "anomaly_detection.enabled",
    "feature_state": "MISSING",
    "action": "INVESTIGATE",
    "description": "Enable anomaly detection observer pipeline",
    "reason": "New key flagged for investigation.",
    "issue": "#1683",
    "adp_key": null
  },
  {
    "key": "anomaly_detection.metrics.enabled",
    "feature_state": "MISSING",
    "action": "INVESTIGATE",
    "description": "Enable metric ingestion for anomaly detection",
    "reason": "New key flagged for investigation.",
    "issue": "#1683",
    "adp_key": null
  },
  {
    "key": "api_key",
    "feature_state": "PARITY",
    "action": "NONE",
    "description": "API key for endpoint auth",
    "reason": "Confirmed implemented in ADP. Behavior matches the core agent.",
    "issue": null,
    "adp_key": null
  },
  {
    "key": "auth_token_file_path",
    "feature_state": "PARITY",
    "action": "NONE",
    "description": "IPC auth token file path",
    "reason": "Confirmed implemented in ADP. Behavior matches the core agent.",
    "issue": null,
    "adp_key": null
  },
  {
    "key": "autoscaling.failover.enabled",
    "feature_state": "MISSING",
    "action": "INVESTIGATE",
    "description": "Enable autoscaling failover metric routing via DCA",
    "reason": "Marked for investigation; previously dismissed as not-applicable.",
    "issue": "#1684",
    "adp_key": null
  },
  {
    "key": "autoscaling.failover.metrics",
    "feature_state": "MISSING",
    "action": "INVESTIGATE",
    "description": "Metric names forwarded to DCA for autoscaling fail",
    "reason": "Marked for investigation; previously dismissed as not-applicable.",
    "issue": "#1684",
    "adp_key": null
  },
  {
    "key": "bind_host",
    "feature_state": "PARITY",
    "action": "NONE",
    "description": "Global listen host fallback",
    "reason": "Read by the DogStatsD source and used as the bind IP for UDP/TCP listeners. Accepts an IP literal or a hostname resolved via DNS. Precedence matches the core agent: dogstatsd_non_local_traffic=true binds 0.0.0.0, else bind_host is used, else 127.0.0.1.",
    "issue": "#1331",
    "adp_key": null
  },
  {
    "key": "cmd_port",
    "feature_state": "PARITY",
    "action": "NONE",
    "description": "Datadog Agent IPC/CMD API port",
    "reason": "Read by RemoteAgentClientConfiguration to build the IPC endpoint URI. Takes precedence over agent_ipc_endpoint when set.",
    "issue": "#1645",
    "adp_key": null
  },
  {
    "key": "config_id",
    "feature_state": "NOT_APPLICABLE",
    "action": "NONE",
    "description": "Fleet Automation config ID tag for agent",
    "reason": "Core Agent only adds config_id to Agent HA telemetry metrics. ADP does not need to stamp it on serialized metric payloads.",
    "issue": "#1751",
    "adp_key": null
  },
  {
    "key": "connect_retry_attempts",
    "feature_state": "ADP_ONLY",
    "action": "NONE",
    "description": "IPC client connect retries",
    "reason": "ADP-only, needed for fast startup.",
    "issue": null,
    "adp_key": null
  },
  {
    "key": "connect_retry_backoff",
    "feature_state": "ADP_ONLY",
    "action": "NONE",
    "description": "IPC client retry delay",
    "reason": "ADP-only, needed for fast startup.",
    "issue": null,
    "adp_key": null
  },
  {
    "key": "container_cgroup_root",
    "feature_state": "PARITY",
    "action": "NONE",
    "description": "Cgroup filesystem root path",
    "reason": "Confirmed implemented in ADP. Behavior matches the core agent.",
    "issue": null,
    "adp_key": null
  },
  {
    "key": "container_proc_root",
    "feature_state": "PARITY",
    "action": "NONE",
    "description": "Procfs root path for containers",
    "reason": "Confirmed implemented in ADP. Behavior matches the core agent.",
    "issue": null,
    "adp_key": null
  },
  {
    "key": "counter_expiry_seconds",
    "feature_state": "ADP_ONLY",
    "action": "NONE",
    "description": "Idle counter keep-alive duration",
    "reason": "Alias for dogstatsd_expiry_seconds for pipeline reuse. Both default to 300s.",
    "issue": null,
    "adp_key": null
  },
  {
    "key": "cri_connection_timeout",
    "feature_state": "PARITY",
    "action": "NONE",
    "description": "CRI container runtime connection timeout (s)",
    "reason": "Confirmed implemented in ADP. Behavior matches the core agent: the value controls the containerd gRPC connection timeout and defaults to 1s.",
    "issue": null,
    "adp_key": null
  },
  {
    "key": "cri_query_timeout",
    "feature_state": "PARITY",
    "action": "NONE",
    "description": "CRI container runtime query timeout (s)",
    "reason": "Confirmed implemented in ADP. Behavior matches the core agent: the value applies to unary containerd RPCs and defaults to 5s; long-lived event streams remain untimed.",
    "issue": null,
    "adp_key": null
  },
  {
    "key": "cri_socket_path",
    "feature_state": "PARITY",
    "action": "NONE",
    "description": "CRI/containerd socket path",
    "reason": "Confirmed implemented in ADP. Behavior matches the core agent.",
    "issue": null,
    "adp_key": null
  },
  {
    "key": "data_plane.api_listen_address",
    "feature_state": "ADP_ONLY",
    "action": "NONE",
    "description": "ADP unprivileged API address",
    "reason": "ADP-only key; core agent has no equivalent. Confirmed fine as-is.",
    "issue": null,
    "adp_key": null
  },
  {
    "key": "data_plane.dogstatsd.enabled",
    "feature_state": "PARITY",
    "action": "NONE",
    "description": "Enable DSD in data plane",
    "reason": "Implemented in both. ADP reads this key natively. adp_key is itself.",
    "issue": null,
    "adp_key": null
  },